{
  "type": "revocation",
  "schemaVersion": 1,
  "pairIdHash": "65628a9e671c78cf2dd85ef5e9522f0bac3e6bb33ad4673ba8a4acf7e846b59f",
  "pairEpoch": 1,
  "sequence": 4,
  "reason": "panic",
  "issuedByDeviceKeyId": "a1b2c3d4e5f6a1b2c3d4e5f6a1b2c3d4e5f6a1b2c3d4e5f6a1b2c3d4e5f6a1b2",
  "createdAt": 1700001000,
  "expiresAt": 1700605800,
  "signature": "ABCDEFGHIJKLMNOPQRSTUVWXYZabcdefghijklmnopqrstuvwxyz0123456789_-ABCDEFGHIJKLMNOPQRSTUV"
}
